{
  "registry_id": "fluencytracr_ai_value_formula_registry",
  "registry_version": "2026_07",
  "schema_version": "FT_AI_VALUE_FORMULA_REGISTRY_2026_07",
  "status": "canonical_metadata_registry",
  "generated_for_change": "add-ai-value-formula-registry",
  "registry_boundary": [
    "metadata_only",
    "not_a_formula_execution_engine",
    "aggregate_only",
    "no_customer_facing_economic_output",
    "no_runtime_tunable_thresholds",
    "no_new_events_or_suppression_reasons"
  ],
  "model_layers": [
    "AI_FLUENCY_MEASUREMENT",
    "VBD_BEHAVIORAL_MEASUREMENT",
    "HYPOTHESIS_OUTCOME_MODELING",
    "COMPARISON_SUPPORTED_DID",
    "HISTORICAL_COUNTERFACTUAL_MODELING",
    "PATHWAY_COHERENCE",
    "EVIDENCE_DESIGN_CLAIM_CAPS",
    "ECONOMIC_VALUE_TRANSLATION",
    "PORTFOLIO_AGGREGATION",
    "DATA_QUALITY_AND_GOVERNANCE_GATES"
  ],
  "formulas": [
    {
      "formula_id": "ai_fluency_observed_dimension_mean",
      "formula_name": "AI Fluency observed dimension mean",
      "formula_version": "2026_07_spec",
      "model_layer": "AI_FLUENCY_MEASUREMENT",
      "implementation_state": "SPECIFIED_NOT_IMPLEMENTED",
      "mathematical_expression": "mean_x[d,c,w] = sum(x[i,d,c,w]) / n[d,c,w]",
      "plain-language_definition": "Observed aggregate mean for an approved AI Fluency dimension, cohort, and wave.",
      "required_inputs": ["approved aggregate dimension values", "approved response count", "dimension", "cohort", "wave"],
      "input_units": {"dimension_values": "instrument scale", "response_count": "aggregate count"},
      "output_unit": "instrument scale",
      "expected_direction": "higher values indicate stronger aggregate dimension posture",
      "applicable_metric_families": ["aggregate_instrument_score"],
      "applicable_evidence_designs": ["BASELINE_ONLY", "REPEATED_PRE_POST", "HISTORICAL_STATE_SPACE"],
      "assumptions": ["inputs are approved aggregate statistics"],
      "limitations": ["does not estimate latent capability", "does not authorize respondent-level export"],
      "prohibited_interpretations": ["realized_roi", "customer_facing_economic_output", "causality_proof", "productivity_measurement", "individual_scoring", "manager_or_team_ranking", "confidence_percentage", "probability_output"],
      "source_contract_refs": ["docs/contracts/ai-value-formula-registry/README.md", "docs/contracts/value-confidence/README.md"],
      "executable_reference_function": null,
      "validation_tests": ["scripts/validate_ai_value_formula_registry.test.mjs"],
      "customer_display_state": "INTERNAL_ONLY",
      "governance_state": "specified_aggregate_only"
    },
    {
      "formula_id": "ai_fluency_aggregate_standard_error",
      "formula_name": "AI Fluency aggregate standard error",
      "formula_version": "2026_07_spec",
      "model_layer": "AI_FLUENCY_MEASUREMENT",
      "implementation_state": "SPECIFIED_NOT_IMPLEMENTED",
      "mathematical_expression": "SE[d,c,w] = s[d,c,w] / sqrt(n[d,c,w])",
      "plain-language_definition": "Aggregate standard error when approved aggregate standard deviation and response count are available.",
      "required_inputs": ["approved aggregate standard deviation", "approved response count"],
      "input_units": {"standard_deviation": "instrument scale", "response_count": "aggregate count"},
      "output_unit": "standard error on instrument scale",
      "expected_direction": "smaller values indicate less aggregate measurement uncertainty",
      "applicable_metric_families": ["aggregate_instrument_score"],
      "applicable_evidence_designs": ["BASELINE_ONLY", "REPEATED_PRE_POST", "HISTORICAL_STATE_SPACE"],
      "assumptions": ["sufficient aggregate uncertainty statistics are present"],
      "limitations": ["must remain missing when sufficient statistics are absent"],
      "prohibited_interpretations": ["realized_roi", "customer_facing_economic_output", "causality_proof", "productivity_measurement", "individual_scoring", "manager_or_team_ranking", "confidence_percentage", "probability_output"],
      "source_contract_refs": ["docs/contracts/ai-value-formula-registry/README.md", "shared/src/aiValueEngine/aiFluencyInstrumentSnapshot.ts"],
      "executable_reference_function": null,
      "validation_tests": ["scripts/validate_ai_value_formula_registry.test.mjs"],
      "customer_display_state": "INTERNAL_ONLY",
      "governance_state": "specified_missing_uncertainty_visible"
    },
    {
      "formula_id": "ai_fluency_snapshot_aggregate_boundary",
      "formula_name": "AI Fluency aggregate snapshot boundary",
      "formula_version": "2026_07_existing",
      "model_layer": "AI_FLUENCY_MEASUREMENT",
      "implementation_state": "IMPLEMENTED_AND_TESTED",
      "mathematical_expression": "validated_snapshot = aggregate_fields + source_lineage + blocked_output_pins",
      "plain-language_definition": "Validates aggregate AI Fluency snapshots and blocks raw respondent, HR, confidence, probability, ROI, and customer-output side doors.",
      "required_inputs": ["aggregate AI Fluency snapshot object"],
      "input_units": {"snapshot": "aggregate contract object"},
      "output_unit": "validation result",
      "expected_direction": "valid snapshots may feed internal model context only when uncertainty and review gates pass",
      "applicable_metric_families": ["aggregate_instrument_score"],
      "applicable_evidence_designs": ["BASELINE_ONLY", "REPEATED_PRE_POST", "HISTORICAL_STATE_SPACE"],
      "assumptions": ["source adapter already produced aggregate-only fields"],
      "limitations": ["does not fit a Fluency measurement model", "does not emit customer output"],
      "prohibited_interpretations": ["realized_roi", "customer_facing_economic_output", "causality_proof", "productivity_measurement", "individual_scoring", "manager_or_team_ranking", "confidence_percentage", "probability_output"],
      "source_contract_refs": ["shared/src/aiValueEngine/aiFluencyInstrumentSnapshot.ts", "scripts/validate_ai_value_ai_fluency_instrument_snapshot.test.mjs"],
      "executable_reference_function": {"source_path": "shared/src/aiValueEngine/aiFluencyInstrumentSnapshot.ts", "export_name": "validateAIFluencyInstrumentSnapshot", "execution_boundary": "existing_runtime_contract", "runtime_callable_from_registry": false},
      "validation_tests": ["npm run test:ai-value-ai-fluency-instrument-snapshot"],
      "customer_display_state": "EXISTING_INTERNAL_CONTRACT",
      "governance_state": "implemented_aggregate_validator"
    },
    {
      "formula_id": "ai_fluency_weighted_aggregate_import",
      "formula_name": "AI Fluency weighted aggregate import",
      "formula_version": "2026_07_existing",
      "model_layer": "AI_FLUENCY_MEASUREMENT",
      "implementation_state": "IMPLEMENTED_AND_TESTED",
      "mathematical_expression": "imported_score = source_version_bound_weighting(source_aggregate_scores)",
      "plain-language_definition": "Imports source-provided aggregate AI Fluency summaries using version-bound adapter logic.",
      "required_inputs": ["aggregate source score package", "instrument version reference"],
      "input_units": {"source_scores": "aggregate score package"},
      "output_unit": "aggregate import contract",
      "expected_direction": "higher values follow the approved source instrument direction",
      "applicable_metric_families": ["aggregate_instrument_score"],
      "applicable_evidence_designs": ["BASELINE_ONLY", "REPEATED_PRE_POST"],
      "assumptions": ["weights are bound to source/instrument version rather than runtime input"],
      "limitations": ["adapter math is not respondent scoring authority"],
      "prohibited_interpretations": ["realized_roi", "customer_facing_economic_output", "causality_proof", "productivity_measurement", "individual_scoring", "manager_or_team_ranking", "confidence_percentage", "probability_output"],
      "source_contract_refs": ["shared/src/aiValueEngine/aiFluencyClientImport.ts", "docs/contracts/ai-value-ai-fluency-client-import/README.md"],
      "executable_reference_function": {"source_path": "shared/src/aiValueEngine/aiFluencyClientImport.ts", "export_name": "buildAIFluencyClientImport", "execution_boundary": "existing_runtime_contract", "runtime_callable_from_registry": false},
      "validation_tests": ["npm run test:ai-value-ai-fluency-client-import"],
      "customer_display_state": "EXISTING_INTERNAL_CONTRACT",
      "governance_state": "implemented_adapter_math_only"
    },
    {
      "formula_id": "ai_fluency_dashboard_scale_normalization",
      "formula_name": "AI Fluency dashboard scale normalization",
      "formula_version": "2026_07_existing",
      "model_layer": "AI_FLUENCY_MEASUREMENT",
      "implementation_state": "IMPLEMENTED_AND_TESTED",
      "mathematical_expression": "normalized_score = dashboard_adapter_scale_map(source_score)",
      "plain-language_definition": "Normalizes approved dashboard aggregate scores between dashboard scale conventions.",
      "required_inputs": ["aggregate dashboard export score", "source scale declaration"],
      "input_units": {"source_score": "dashboard scale"},
      "output_unit": "normalized aggregate score",
      "expected_direction": "higher values retain source-positive direction",
      "applicable_metric_families": ["aggregate_instrument_score"],
      "applicable_evidence_designs": ["BASELINE_ONLY", "REPEATED_PRE_POST"],
      "assumptions": ["scale declaration is source-bound"],
      "limitations": ["not canonical item scoring", "not a latent measurement model"],
      "prohibited_interpretations": ["realized_roi", "customer_facing_economic_output", "causality_proof", "productivity_measurement", "individual_scoring", "manager_or_team_ranking", "confidence_percentage", "probability_output"],
      "source_contract_refs": ["shared/src/aiValueEngine/aiFluencyDashboardImportRunner.ts", "docs/contracts/ai-value-ai-fluency-dashboard-import-runner/README.md"],